date,text
201811,"Tena koutou katoa, welcome all.
The Official Cash Rate (OCR) remains at 1.75 percent. We expect to keep the OCR at this level through 2019 and into 2020.
There are both upside and downside risks to our growth and inflation projections. As always, the timing and direction of any future OCR move remains data dependent.
The pick-up in GDP growth in the June quarter was partly due to temporary factors, and business surveys continue to suggest growth will be soft in the near term. Employment is around its maximum sustainable level. However, core consumer price inflation remains below our 2 percent target mid-point, necessitating continued supportive monetary policy.
GDP growth is expected to pick up over 2019. Monetary stimulus and population growth underpin household spending and business investment. Government spending on infrastructure and housing also supports domestic demand. The level of the New Zealand dollar exchange rate will support export earnings.
As capacity pressures build, core consumer price inflation is expected to rise to around the mid-point of our target range at 2 percent.
Downside risks to the growth outlook remain. Weak business sentiment could weigh on growth for longer. Trade tensions remain in some major economies, raising the risk that trade barriers increase and undermine global growth.
Upside risks to the inflation outlook also exist. Higher fuel prices are boosting near-term headline inflation.  We will look through this volatility as appropriate. Our projection assumes firms have limited pass through of higher costs into generalised consumer prices, and that longer-term inflation expectations remain anchored at our target.    
We will keep the OCR at an expansionary level for a considerable period to contribute to maximising sustainable employment, and maintaining low and stable inflation.
Meitaki, thanks.
  More information
Read the November 2018 Monetary Policy Statement
Media contact
Naomi Mitchell
Manager, Communications
027 294 3900
Naomi.Mitchell@rbnz.govt.nz
 "
201902,"Statement by Reserve Bank Governor Adrian Orr:
Tena koutou katoa, welcome all.
The Official Cash Rate (OCR) remains at 1.75 percent. We expect to keep the OCR at this level through 2019 and 2020. The direction of our next OCR move could be up or down.
Employment is near its maximum sustainable level. However, core consumer price inflation remains below our 2 percent target mid-point, necessitating continued supportive monetary policy.
Trading-partner growth is expected to further moderate in 2019 and global commodity prices have already softened, reducing the tailwind that New Zealand economic activity has benefited from. The risk of a sharper downturn in trading-partner growth has also heightened over recent months.
Despite the weaker global impetus, we expect low interest rates and government spending to support a pick-up in New Zealand’s GDP growth over 2019. Low interest rates, and continued employment growth, should support household spending and business investment. Government spending on infrastructure and housing also supports domestic demand.
As capacity pressures build, consumer price inflation is expected to rise to around the mid-point of our target range at 2 percent.
There are upside and downside risks to this outlook. A more pronounced global downturn could weigh on domestic demand, but inflation could rise faster if firms pass on cost increases to prices to a greater extent.
We will keep the OCR at an expansionary level for a considerable period to contribute to maximising sustainable employment, and maintaining low and stable inflation.
Meitaki, thanks.
More Information
Download the February 2019 Monetary Policy Statement (PDF 2.31MB)
Read the February 2019 Monetary Policy Statement
Media contact:
Naomi Mitchell
Manager, Communications
DDI: +64 4 471 3836 | MOB: 027 294 3900
Email: Naomi.Mitchell@rbnz.govt.nz"
201903,"The Official Cash Rate (OCR) remains at 1.75 percent. Given the weaker global economic outlook and reduced momentum in domestic spending, the more likely direction of our next OCR move is down.
Employment is near its maximum sustainable level. However, core consumer price inflation remains below our 2 percent target mid-point, necessitating continued supportive monetary policy.
The global economic outlook has continued to weaken, in particular amongst some of our key trading partners including Australia, Europe, and China. This weaker outlook has prompted central banks to ease their expected monetary policy stances, placing upward pressure on the New Zealand dollar.
Domestic growth slowed in 2018, with softness in the housing market and weak business investment contributing.
We expect ongoing low interest rates, and increased government spending and investment, to support economic growth over 2019. Low interest rates, and continued employment growth, should support household spending and business investment. Government spending on infrastructure, housing, and transfer payments also supports domestic demand.
As capacity pressures build, consumer price inflation is expected to rise to around the mid-point of our target range at 2 percent.
The balance of risks to this outlook has shifted to the downside. The risk of a more pronounced global downturn has increased and low business sentiment continues to weigh on domestic spending. On the upside, inflation could rise faster if firms pass on cost increases to prices to a greater extent.
We will keep the OCR at an expansionary level for a considerable period to contribute to maximising sustainable employment, and maintaining low and stable inflation.
Meitaki, thanks.
Media contact:
Naomi Mitchell
Manager, Communications
DDI: +64 4 471 3836 | MOB: 027 294 3900
Email: Naomi.Mitchell@rbnz.govt.nz"
201905,"Tena koutou katoa, welcome all.
The Official Cash Rate (OCR) has been reduced to 1.5 percent.
The Monetary Policy Committee decided a lower OCR is necessary to support the outlook for employment and inflation consistent with its policy remit.
Global economic growth has slowed since mid-2018, easing demand for New Zealand’s goods and services. This lower global growth has prompted foreign central banks to ease their monetary policy stances, supporting growth prospects.
However, there is uncertainty about the global economic outlook. Trade concerns remain, while some other indicators suggest trading-partner growth is stabilising.
Domestic growth slowed from the second half of 2018. Reduced population growth through lower net immigration, and continuing house price softness in some areas, has tempered the growth in household spending. Ongoing low business sentiment, tighter profit margins, and competition for resources has restrained investment.
Employment is near its maximum sustainable level. However, the outlook for employment growth is more subdued and capacity pressure is expected to ease slightly in 2019. Consequently, inflationary pressure is projected to rise only slowly.
Given this employment and inflation outlook, a lower OCR now is most consistent with achieving our objectives and provides a more balanced outlook for interest rates.
Meitaki, thanks.
Record of Meeting
The Monetary Policy Committee agreed on the economic projections outlined in the May 2019 Statement in order to provide a sound basis on which to form its OCR decision.
The Committee noted that inflation is currently slightly below the mid-point of the inflation target, and that employment is broadly at the targeted maximum sustainable level. However, the members agreed that given the recent weaker domestic spending, and projected ongoing growth and employment headwinds, there was a need for further monetary stimulus to meet its objectives.
The Committee agreed that the risks to achieving its consumer price inflation and maximum sustainable employment objectives were broadly balanced around the projection. Possible alternative outcomes were noted on the upside and downside.
A key downside risk relating to the growth projections was a larger than anticipated slowdown in global economic growth, particularly in China and Australia, New Zealand's largest trading partners. The Committee agreed that the projections adequately captured the observed global slowdown and its impact on domestic employment and inflation.
The Committee noted that additional stimulus from central banks had underpinned growth and reduced the likelihood of a more-pronounced slowdown. With some indicators of global growth improving in recent months, a faster recovery in global growth was possible. However, on balance, the Committee was more concerned about a continued slowdown rather than a faster recovery.
The Committee discussed other potential risks to domestic spending. The members acknowledged the importance of additional spending from households, businesses, and the government, to meet their inflation and employment targets. However, they noted several important uncertainties.
The Committee noted upside and downside risks to the investment outlook. Capacity pressure could see investment increase faster than assumed. On the downside, if sentiment remained low as profitability remains squeezed, investment might not increase as anticipated over the medium term. It was also noted that firms' ability to invest is constrained by the current competition for resources.
A potential source of additional demand discussed by the Committee included government spending being higher than currently projected, in view of the current strength of the Crown balance sheet. This view was balanced by the impact of any increase in government investment being delayed, for example due to timing of the implementation of new initiatives and current capacity constraints in the construction sector. The implications for monetary policy remain to be seen.
Some members noted that with lower mortgage rates and easing of loan-to-value requirements, any possible pick-up in the housing market could support household spending growth more than anticipated. The Committee noted that employment is currently near its maximum sustainable level. However, it was agreed that the outlook for employment growth is more subdued and capacity pressure is expected to ease slightly in 2019.
The Committee agreed that overall risks to the inflation projection were balanced. The Committee noted the outlook for inflation is below the target mid-point for longer than projected in the February Statement.
The recent period of rising domestic inflation was discussed. The Committee noted that the near-term outlook was more subdued due to lower capacity pressure. It was also noted that cost pressures remain elevated, and that there is a risk firms may pass these costs on as higher consumer prices by more than assumed. However, it was agreed that inflation expectations remain well anchored at the mid-point of the target range.
The Committee also noted the relatively subdued private sector wage growth, despite businesses suggesting that the inability to find labour is a significant constraint on their growth. The Committee noted the limited pass-through of the nominal wage growth to consumer price inflation.
Some members noted slower global growth reducing imported inflation was a downside risk to the inflation outlook.
The Committee reached a consensus that, relative to the February Statement, a lower path for the OCR over the projection period was appropriate. The lower path reflected the economic projections and the balance of risks discussed, and is consistent with both inflation and employment remaining near the Committee's objectives.
After discussing the relative benefits of holding the OCR and committing to a downward bias, versus cutting the OCR now so as to establish a more balanced outlook for interest rates, the Committee reached a consensus to cut the OCR to 1.50 percent.
Attendees
Reserve Bank staff: Adrian Orr, Geoff Bascand, Christian Hawkesby, Yuong Ha
External: Bob Buckle, Peter Harris
Observer: Gabriel Makhlouf
Secretary: Chris McDonald
Apologies: Caroline Saunders
More Information
Download the May 2019 Monetary Policy Statement (PDF 1.75MB)
May 2019 Monetary Policy Statement page
Media contact:
Naomi Mitchell
Manager, Communications
DDI: +64 4 471 3836 | MOB: 027 294 3900
Email: Naomi.Mitchell@rbnz.govt.nz"
201906,"The Official Cash Rate (OCR) remains at 1.5 percent. Given the weaker global economic outlook and the risk of ongoing subdued domestic growth, a lower OCR may be needed over time to continue to meet our objectives.
Domestic growth has slowed over the past year. While construction activity strengthened in the March 2019 quarter, growth in the services sector continued to slow. Softer house prices and subdued business sentiment continue to dampen domestic spending.
The global economic outlook has weakened, and downside risks related to trade activity have intensified. A number of central banks are easing their monetary policy settings to support demand. The weaker global economy is affecting New Zealand through a range of trade, financial, and confidence channels.
We expect low interest rates and increased government spending to support a lift in economic growth and employment. Inflation is expected to rise to the 2 percent mid-point of our target range, and employment to remain near its maximum sustainable level.
Given the downside risks around the employment and inflation outlook, a lower OCR may be needed.
Meitaki, thanks.
Summary Record of Meeting
The Monetary Policy Committee agreed that the outlook for the economy has softened relative to the projections in the May 2019 Statement.
The Committee noted that inflation remains slightly below the mid-point of the inflation target and employment is broadly at its maximum sustainable level. The Committee agreed that a lower OCR may be needed to meet its objectives, given further deterioration in the outlook for trading-partner growth and subdued domestic growth.
Relative to the May Statement, the Committee agreed that the risks to achieving its consumer price inflation and maximum sustainable employment objectives are tilted to the downside.
The members noted that global economic growth had continued to slow. They discussed the recent falls in oil and dairy prices, and that several central banks are now expected to ease monetary policy to support demand.
The Committee discussed the ongoing weakening in global trade activity. A drawn out period of tension could continue to suppress global business confidence and reduce growth. Resolution of these tensions could see uncertainty ease.
The Committee discussed the trade, financial, and confidence channels through which slowing global growth and trade tensions affect New Zealand. The members noted in particular the dampening effect of uncertainty on business investment. Some members noted that lower commodity prices and upward pressure on the New Zealand dollar could see imported inflation remain soft.
While global economic conditions had deteriorated, the Committee noted that domestic GDP growth had held up more than projected in the March 2019 quarter. The members discussed disparities in growth across sectors of the economy, with construction strong and services weak. The members also discussed whether some of the factors supporting growth in the quarter would continue.
The members noted two largely offsetting developments affecting the outlook for domestic growth: softer house price inflation and additional fiscal stimulus.
The Committee noted that recent softer house prices, if sustained, are likely to dampen household spending. The Committee also noted the recent falls in mortgage rates and the Government’s decision not to introduce a capital gains tax.
The Committee noted that Budget 2019 incorporated a stronger outlook for government spending than assumed in the May Statement. The members discussed the impact on growth of any increase in government spending being delayed, for example due to timing of the implementation of new initiatives and current capacity constraints in the construction sector.
The members discussed the subdued nominal wage growth in the private sector and the apparent disconnect from indicators of capacity pressure in the labour market. The Committee discussed the possibility of this relationship re-establishing. Conversely, the continuing absence of wage pressure could indicate that there is still spare capacity in the labour market. Some members also noted that reduced migrant inflows could see wage pressure increase in some sectors.
The Committee discussed whether additional monetary stimulus was necessary given continued falls in global growth and subdued domestic demand. The members agreed that more support from monetary policy was likely to be necessary.
The Committee discussed the merits of lowering the OCR at this meeting. However, the Committee reached a consensus to hold the OCR at 1.5 percent. They noted a lower OCR may be needed over time.
Attendees
Reserve Bank staff: Adrian Orr, Geoff Bascand, Christian Hawkesby, Yuong Ha
External: Bob Buckle, Peter Harris, Caroline Saunders
Observer: Gabriel Makhlouf
Secretary: Chris McDonald
Media contact:
Naomi Mitchell
Manager, Communications
DDI: +64 4 471 3836 | MOB: 027 294 3900
Email: Naomi.Mitchell@rbnz.govt.nz"
201908,"Tēnā koutou katoa, welcome all.
The Official Cash Rate (OCR) is reduced to 1.0 percent. The Monetary Policy Committee agreed that a lower OCR is necessary to continue to meet its employment and inflation objectives.
Employment is around its maximum sustainable level, while inflation remains within our target range but below the 2 percent mid-point. Recent data recording improved employment and wage growth is welcome.
GDP growth has slowed over the past year and growth headwinds are rising. In the absence of additional monetary stimulus, employment and inflation would likely ease relative to our targets.
Global economic activity continues to weaken, easing demand for New Zealand’s goods and services. Heightened uncertainty and declining international trade have contributed to lower trading-partner growth. Central banks are easing monetary policy to support their economies. Global long-term interest rates have declined to historically low levels, consistent with low expected inflation and growth rates into the future.
In New Zealand, low interest rates and increased government spending will support a pick-up in demand over the coming year. Business investment is expected to rise given low interest rates and some ongoing capacity constraints. Increased construction activity also contributes to the pick-up in demand.
Our actions today demonstrate our ongoing commitment to ensure inflation increases to the mid-point of the target range, and employment remains around its maximum sustainable level.
Meitaki, thanks.
Summary record of meeting – August 2019 Statement
The Monetary Policy Committee agreed there was a need for further monetary stimulus to meet its inflation and employment objectives.
The Committee noted recent economic developments were broadly as expected and employment was around the targeted maximum sustainable level. The Committee was pleased to see that the labour market data held up relative to expectations in the June 2019 quarter.
However, the Committee noted that inflation remains below 2 percent and the outlook for employment and inflation was softer. GDP growth had slowed and global conditions had weakened.
The Committee agreed that the balance of risks to achieving its consumer price inflation and maximum sustainable employment objectives was tilted to the downside, although members placed different emphasis on the sensitivities to these risks.
The Committee noted the decline in long-term government bond yields to historically low levels. Financial market participants expect both inflation and policy interest rates to remain low globally for a prolonged period. Some members noted that survey measures of short-term inflation expectations in New Zealand had declined recently. Others were encouraged that longer-term expectations remained anchored at close to 2 percent.
The Committee agreed that weak global economic conditions could see imported inflation remain low if global growth slows further or if commodity prices decline. The members discussed the range of appropriate policy responses should imported inflation persist at low levels.
The Committee welcomed the recent employment and wage data but noted that private sector wage growth was subdued despite businesses having difficulty finding labour. The members discussed that the recent slowdown in growth could dampen wage inflation by more than assumed. Some noted that if cost pressures remain elevated, firms may pass on costs to consumer prices by more than assumed, while others viewed the wage pass through as a natural consequence of a tight labour market and policy stimulus.
The members discussed the recent slower domestic GDP growth and the impact of slowing global demand on New Zealand through the trade, financial and confidence channels. The members noted that heightened global uncertainty was reducing investment and suppressing trading-partner growth. This highlighted the risk of a larger or more prolonged slowdown in global economic growth.
The Committee noted that additional stimulus from central banks had underpinned growth and reduced the likelihood of a more-pronounced slowdown. However, some thought that even with support from monetary stimulus, considerable economic and policy uncertainty could see global growth continue to decline. Other members noted that the easing in global financial conditions since the beginning of the year, or a shift in political environment, could lead to a pick-up in global growth over the next year.
The Committee acknowledged the importance of additional spending from households, businesses, and the government, to meet their inflation and employment targets. They also agreed that additional monetary stimulus was needed. The members discussed several important uncertainties.
The Committee noted that low business confidence had dampened business investment in 2018 and had remained weak in mid-2019. The members discussed that if sentiment remained low, perhaps due to global economic conditions or if profitability remains squeezed, growth might not increase as anticipated over the medium term. The members also noted that the shift in domestic production from manufacturing towards services was also dampening business investment.
The outlook for household spending was discussed with regard to the assumed dampening impact of soft house price inflation. Some members noted lower mortgage rates could contribute to a stronger pick-up in house price inflation, which could support consumption. Other members noted that house price inflation could remain weak, for example if net immigration continued to decline relative to the number of new houses being constructed.
The Committee noted that fiscal assumptions embedded in the projections were consistent with Budget 2019, which included adjustments to reflect that government spending takes time to increase. The members discussed that fiscal policy could be more supportive if future announcements incorporate more spending or if the impact on domestic demand is larger than assumed. This view was balanced by the impact of any increase in government spending being delayed, for example due to timing of the implementation of new initiatives and difficulty finding labour.
The Committee also discussed the contribution of monetary policy to the projected pick-up in growth and inflation. The members noted that estimates of the neutral level of interest rates have continued to decline and this was consistent with generally lower interest rates over time. Members also noted the Bank’s current assessment of analysis on the transmission from monetary policy to growth and inflation. This suggested that the overall strength of these relationships was little changed in the environment of low interest rates.
The Committee agreed to continue to monitor and assess the impacts of monetary policy, including the transmission through to retail interest rates.
The Committee reached a consensus that, relative to the May Statement, a lower path for the OCR over the projection period was appropriate. The lower OCR path reflected the economic projections and the balance of risks discussed.
The members debated the relative benefits of reducing the OCR by 25 basis points and communicating an easing bias, versus reducing the OCR by 50 basis points now. The Committee noted both options were consistent with the forward path in the projections. The Committee reached a consensus to cut the OCR by 50 basis points to 1.0 percent. They agreed that the larger initial monetary stimulus would best ensure the Committee continues to meet its inflation and employment objectives.
Attendees:
Reserve Bank staff: Adrian Orr, Geoff Bascand, Christian Hawkesby, Yuong Ha
External: Bob Buckle, Peter Harris, Caroline Saunders
Observer: Bryan Chapple
Secretary: Chris McDonald
More information:
Download the August 2019 Monetary Policy Statement (PDF 1.6MB)
August 2019 Monetary Policy Statement page
Media contact:
Naomi Mitchell
Head of Communications
DDI: +64 4 471 3836 | MOB: 027 294 3900
Email: Naomi.Mitchell@rbnz.govt.nz"
