date,text
202008,"Tēnā koutou katoa, welcome all.
The Monetary Policy Committee agreed to expand the Large Scale Asset Purchase (LSAP) programme up to $100 billion so as to further lower retail interest rates in order to achieve its remit. The eligible assets remain the same and the Official Cash Rate (OCR) is being held at 0.25 percent in accordance with the guidance issued on 16 March.
Reflecting a possible need for further monetary stimulus, the Committee also agreed that a package of additional monetary instruments must remain in active preparation. The deployment of such tools will depend on the outlook for inflation and employment. The package of further instruments includes a negative OCR supported by funding retail banks directly at near-OCR (a Funding for Lending Programme). Purchases of foreign assets also remain an option.
Over recent months New Zealand had contained the spread of COVID-19 locally, allowing a relaxation of social restrictions and a recovery in economic activity. Recent indicators highlight that the faster return to social norms and a higher proportion of employees working from home has seen output and employment recover sooner than projected in our May Monetary Policy Statement. Recent spending also reflected pent up demand resulting from the lockdown period.
However, the severe global economic disruption caused by the pandemic is persisting. Any significant change in the global and domestic economic outlook remains dependent on the containment of the virus, which is highly uncertain as evidenced today by the return to social restrictions in New Zealand. Such uncertainty is stifling household and business spending appetites, as highlighted in confidence surveys. Given the ongoing health uncertainty, there remains a downside risk to our baseline economic scenario.
International border restrictions will continue to significantly curtail migration and tourism, and lead to the activity outlook being uneven across industries and regions. Commodity prices for New Zealand’s exports remain robust, but this has been partly offset by a rise in the New Zealand dollar exchange rate moderating the return to local export producers.
Ongoing support for domestic economic activity is being provided through significant government spending on business assistance and household income support. This will be supported by a rising level of government investment. However, there will be a transition of policies in the near-term, with the announced end of the Wage Subsidy likely to coincide with a decline in employment.
Monetary policy will continue to provide important economic support in the period ahead. Its effectiveness is evidenced by retail banks’ lower funding costs and lending rates, which are benefiting businesses and households. It remains in the long-term interest of banks to fully pass on the benefits of lower funding costs to their customers.
The Monetary Policy Committee will provide additional stimulus as necessary to meet its remit.
Meitaki, thanks.
More information
Download the August 2020 Monetary Policy Statement (PDF 1.85MB)
Alternative Monetary Policy Tools
MOF/RBNZ Memorandum of Understanding regarding the use of alternative monetary policy tools (PDF 883KB)
Letter from the Reserve Bank to the Minister of Finance – August 2020
Letter of Indemnity from the Minister of Finance – August 2020
Response letter from the Minister of Finance – August 2020
August 2020 Monetary Policy Statement
Summary Record of Meeting - August 2020 MPS
The Monetary Policy Committee (MPC) discussed the outlook for inflation and employment, and whether current monetary conditions will achieve its policy remit. The ongoing economic effects of the COVID-19 pandemic were central to the discussion. Members agreed that significant uncertainty existed as to virus containment, and that this was dampening economic confidence globally.
The Committee noted that New Zealand had contained the local spread of the virus, thereby enabling the relaxation of social restrictions. Members agreed that recent domestic economic activity and employment had been stronger than expected in the May Monetary Policy Statement. They noted that this was largely due to the earlier than assumed relaxation of social restrictions, a higher proportion of people working from home, and the pent up demand that arose due to the lockdown period.
The Committee noted that the recovery in economic activity had been uneven across industries and regions, with ongoing international border restrictions severely curtailing migration and services’ export earnings – such as tourism and foreign student education. The Committee noted that domestic economic activity remains below the level it was at prior to the COVID-19 outbreak, and that a sustainable recovery in investment and employment depends on both the degree to which the virus is contained effectively and on a reduction in uncertainty in the general economic environment. Members noted that fiscal policy continues to provide the primary support to the economy, as is appropriate given the pace and scale of the economic shock.
Members agreed that global uncertainty is significantly dampening consumer and business confidence to spend, invest, and employ over the near term. As a result the Committee agreed that the outlook for global economic activity remains weak. It also noted that a rise in the New Zealand dollar exchange rate has moderated local exporters’ incomes.
Members discussed the balance of risks to the baseline economic scenario prepared for the August Statement. Members agreed that, given the primary economic risks are health-related, as evidenced by recent events, the economic risks remain to the downside. The Committee noted a risk that persistent low inflation and employment become embedded in people’s expectations, creating the need for more monetary stimulus than otherwise.
The Committee discussed the current effectiveness of monetary policy. The Committee agreed that monetary policy remains effective and has a strong support role for the economy through improving cash-flow, increasing the incentive to invest, and keeping the exchange rate lower than otherwise. Members agreed that these transmission channels are important for the Committee to achieve its remit and would be important for enabling any necessary resource reallocation during a recovery.
Members noted that retail interest rates have declined consistent with the lower funding costs brought about by the recent monetary easing. The Committee also agreed that it remains in the best long-term interests of banks to continue to pass on the lower wholesale interest rates to their customers, and to maintain the supply of credit.
The Committee then discussed the appropriateness of current monetary settings for achieving its remit. The Committee agreed that, given the weak economic outlook, low inflation and employment, further monetary stimulus is needed to achieve its remit objectives.
The Committee discussed the monetary policy strategy having regard to the soundness and efficiency of the financial system, and to avoiding unnecessary instability in output, interest rates and the exchange rate. Members weighed the risks associated with potential actions in pursuit of achieving the operational objectives of the remit against the risks and consequences of insufficient monetary stimulus. On balance, the Committee agreed that a deep and protracted economic downturn with high unemployment would pose a more serious risk to financial stability.
Members discussed the implications of alternative monetary policy tools for financial stability. The discussion covered the tools that are being considered, noted the lessons and experiences from other central banks, and considered the calibration of a package of monetary instruments. The Committee agreed that a lower or negative OCR, a Funding for Lending Programme, purchasing of foreign assets, and interest rate swaps all provided policy optionality.
The Committee noted staff advice that the design features of each tool could be selected to maximise effectiveness and reduce risks to financial stability. The Committee expressed a preference for considering a package of a negative OCR and a ‘Funding for Lending Programme’ in addition to the current Large Scale Asset Purchase (LSAP) programme. The Committee instructed staff to prepare advice on the design of a package for deployment if deemed necessary, taking account of the operational readiness of the financial system.
The Committee agreed that the most immediately available suitable tool is an expansion to the Large Scale Asset Purchase (LSAP) programme. The Committee discussed expanding the LSAP programme with the aim of adding more stimulus by lowering retail interest rates and the exchange rate.
Members noted the increase in New Zealand’s sovereign debt issuance, which means that the market for bonds is now larger than previously. The Committee noted updated staff advice that central bank purchases could absorb a larger proportion of the total market than previously thought without affecting market functioning. Members noted and endorsed staff advice that a larger LSAP programme would mean purchases could be front-loaded in order to put more downward pressure on New Zealand wholesale interest rates.
The Committee agreed that an increased LSAP limit of up to $100 billion by June 2022 would enable the Bank to implement purchases to lower wholesale interest rates. Members agreed that the Bank should retain the flexibility to adjust the pace and composition of bond purchases as market conditions dictate.
The Committee also agreed that any future move to a lower or negative OCR, if complemented by a Funding for Lending Programme, could provide an effective way to deliver monetary stimulus in addition to the expanded LSAP if needed.
On Wednesday 12 August, the Committee reached a consensus to:
expand the LSAP programme to purchase up to a maximum of $100b by June 2022;
direct the Bank to actively prepare a package of additional monetary policy tools, to be deployed if and when the outlook for inflation and employment requires additional stimulus, taking into account operational readiness; and
hold the OCR at 25 basis points in accordance with the guidance issued on 16 March.
Attendees
Reserve Bank members of MPC: Adrian Orr, Geoff Bascand, Christian Hawkesby, Yuong Ha
External MPC members: Bob Buckle, Peter Harris, Caroline Saunders
Treasury Observer: Caralee McLiesh
MPC Secretary: Gael Price
Media contact:
Naomi Mitchell
Head of Communications
DDI: +64 4 471 3836 | MOB: 027 294 3900
Email: Naomi.Mitchell@rbnz.govt.nz"
202009,"Tēnā koutou katoa, welcome all.
The Monetary Policy Committee agreed to continue with the Large Scale Asset Purchase (LSAP) Programme up to $100 billion. This action is necessary to further lower household and business borrowing rates in order to achieve the Committee’s inflation and employment remit. The Official Cash Rate (OCR) is being held at 0.25 percent in accordance with the guidance issued on 16 March.
Reflecting the possible need for further monetary stimulus, the Committee noted the progress being made on the Bank’s ability to deploy additional monetary instruments. The instruments include a Funding for Lending Programme (FLP), a negative OCR, and purchases of foreign assets. The Committee agreed that these instruments can be mutually supportive in bolstering economic activity. Members also agreed that the alternative instruments can be deployed independently, and noted that the FLP would be ready before the end of this calendar year.
Economic information available since the August Monetary Policy Statement, both international and domestic, has confirmed the level of economic activity remains significantly below that experienced prior to the COVID-19 economic disruption. The ongoing virus-led activity restrictions – most notably in Auckland – had also continued to dampen economic activity, and business and consumer confidence.
Any significant change in the global and domestic economic outlook remain dependent on the containment of the virus, which is highly uncertain. International border restrictions will continue to significantly curtail migration and tourism, and lead to the activity outlook being uneven across industries and regions. Commodity prices for New Zealand’s exports remain robust, but this has been partly offset by the New Zealand dollar exchange rate moderating the return to local export producers.
Ongoing support for domestic economic activity is being provided through significant government spending on business assistance and household income support. This will be accompanied by a rising level of government investment. However, the removal of temporary support policies has commenced. For example, the Wage Subsidy scheme is now closed to new entrants.
In line with the weak underlying international and domestic economic conditions, the Committee expects a rise in unemployment and an increase in firm closures, as resource reallocation continues. Members agreed that monetary policy will need to provide significant economic support for a long time to come to meet the inflation and employment remit, and promote financial stability. They also agreed they are prepared to provide additional stimulus.
Summary record of meeting
The Monetary Policy Committee discussed international and domestic economic and financial market developments. The Committee noted that global economic activity had increased in recent months as social restrictions in some regions had eased, and that the consensus outlook was for a partial recovery in the level of economic activity. Members agreed that the balance of risks to the global economic outlook remained to the downside. The Committee noted that cases of COVID-19 were growing and social restrictions were being reintroduced in some regions of the world, including some areas where the virus had previously appeared to have been reasonably well contained. Members noted that while global monetary and fiscal easing has supported financial and economic conditions, there was a risk that the recent recovery in international activity could stall or reverse if policy stimulus was withdrawn prematurely.
The Committee noted that the August outbreak of COVID-19 in New Zealand appeared to now be contained. Restrictions imposed to contain the virus had constrained economic activity, but were being relaxed. Some members observed that the outbreak had dented confidence, as firms and households are wary of a future outbreak with a subsequent reduction in activity and spending.
The Committee noted the historically unprecedented contraction in economic activity in the June quarter, as measured by the national accounts. The size of the contraction had been smaller than earlier expectations. The Committee noted that some more timely measures of activity had recovered quickly following the easing of restrictions after the initial lockdown, but had dipped again as restrictions were re-introduced, particularly in Auckland. The Committee agreed that the pandemic and associated travel restrictions could have a significant long-term negative impact on the economy, with lower potential growth as resources were gradually redeployed within and between industries. Some members noted that it is also harder to estimate what the maximum sustainable level of employment is under these conditions.
The Committee discussed the recent strength in the housing market. House prices had risen over recent months, in contrast to the Reserve Bank’s baseline scenario which had assumed a decline. Some members noted that economic activity in New Zealand has historically been closely correlated with changes in household wealth, and that a stronger housing market may indicate a stronger recovery in consumer spending and residential construction if sustained. However, other members noted that low population growth and rising unemployment are expected to constrain further house price increases.
Members agreed that the outlook for inflation and employment remained subdued. Members discussed the balance of risks, and agreed that they remained to the downside. There is substantial uncertainty about the future spread of COVID-19 both domestically and globally, and how economic, health, and social activity will adapt.
The Committee discussed the effects of monetary policy easing measures taken so far. Members agreed that the reductions in the OCR, forward guidance, and Large Scale Asset Purchase (LSAP) programme had contributed to lower wholesale, household, and business interest rates, and had kept the exchange rate lower than otherwise. Members noted that the expansion and front-loading of the LSAP programme after the August Statement had contributed to lower government bond yields. They also noted that market participants now believed that it was likely the OCR would be reduced below zero next year, and that this had also contributed to lower wholesale interest rates. The Committee expected lenders to continue to pass through these reductions in wholesale rates to household and business borrowing rates over time.
The Committee reaffirmed that a Funding for Lending Programme (FLP), a lower or negative OCR, purchases of foreign assets, and interest rate swaps remain under consideration. The Committee maintained its view as expressed in the August Statement that a package of an FLP and a lower or negative OCR could provide an effective way to deliver additional monetary stimulus.
The Committee discussed the sequencing of deployment of the components of the package. Members noted staff advice that deploying an FLP before the forward guidance period for holding the OCR ends could provide additional stimulus to the economy sooner. Having an FLP in place earlier would provide certainty to financial institutions planning their funding needs, and speed up the transmission of the programme by allowing banks to replace funding as it matures over time.
The Committee agreed that providing term funding at rates near the OCR via an FLP would lower the financial system’s funding costs, and therefore borrowing costs for firms and households, and support the availability of credit to the economy. The effectiveness of the programme would be influenced by the degree to which financial institutions passed on their funding cost declines to their customers. Members agreed that they preferred to launch an FLP before the end of 2020.
The Committee noted that the banking system is on track to be operationally prepared for negative interest rates by year end. Members agreed with the previous assessment that a lower OCR would be complementary to its other monetary policy tools, and that it was prepared to lower the OCR to provide additional stimulus if required.
The Committee endorsed staff advice to continue front-loading purchases under the LSAP programme, while maintaining flexibility to adjust purchases as market conditions dictate.
The Committee discussed the appropriate settings for monetary policy. It agreed that further monetary stimulus may be needed in order to achieve its remit objectives. The Committee agreed that a severe and prolonged economic downturn would make it difficult to achieve its inflation and employment objectives, and at the same time would pose a material risk to financial stability. Providing sufficient monetary stimulus would therefore both help achieve the Committee’s remit objectives, and promote financial stability.
On Wednesday 23 September, the Committee reached a consensus to:
hold the OCR at 0.25 percent, in accordance with the guidance issued on 16 March;
maintain the existing LSAP programme of a maximum of $100b by June 2022; and
direct the Bank to prepare to have an FLP ready to deploy before the end of this calendar year. Details on the design of the programme would be agreed and published ahead of deployment.
Attendees:
Reserve Bank staff: Adrian Orr, Geoff Bascand, Christian Hawkesby, Yuong Ha
External: Bob Buckle, Peter Harris, Caroline Saunders
Observer: Tim Ng
Secretary: Ross Kendall
Additional information:
LSAP indicative schedule
Media contact:
Naomi Mitchell
Head of Communications
DDI: +64 4 471 3836 | MOB: 027 294 3900
Email: Naomi.Mitchell@rbnz.govt.nz"
